{
  "id": "example-http-api",
  "name": "HTTP API Workflow",
  "description": "Fetches data from an API and processes it",
  "version": "1.0.0",
  "nodes": [
    {
      "id": "start",
      "functionId": "core.start",
      "params": {},
      "position": {
        "x": 100,
        "y": 150
      },
      "label": "core.start"
    },
    {
      "id": "fetch-todo",
      "functionId": "http.get",
      "params": {
        "url": "https://jsonplaceholder.typicode.com/todos/2",
        "outputKey": "todo"
      },
      "position": {
        "x": 300,
        "y": 150
      },
      "label": "http.get"
    },
    {
      "id": "extract-title",
      "functionId": "transform.map",
      "params": {
        "inputKey": "todo",
        "path": "title",
        "outputKey": "todoTitle"
      },
      "position": {
        "x": 500,
        "y": 150
      },
      "label": "transform.map"
    },
    {
      "id": "format-message",
      "functionId": "transform.template",
      "params": {
        "template": "Todo item: {{todoTitle}}",
        "outputKey": "message"
      },
      "position": {
        "x": 700,
        "y": 150
      },
      "label": "transform.template"
    },
    {
      "id": "log-message",
      "functionId": "core.log",
      "params": {
        "key": "message"
      },
      "position": {
        "x": 900,
        "y": 150
      },
      "label": "core.log"
    },
    {
      "id": "end",
      "functionId": "core.end",
      "params": {
        "outputKey": "message"
      },
      "position": {
        "x": 1100,
        "y": 150
      },
      "label": "core.end"
    }
  ],
  "edges": [
    {
      "from": "start",
      "to": "fetch-todo",
      "action": "default"
    },
    {
      "from": "fetch-todo",
      "to": "extract-title",
      "action": "success"
    },
    {
      "from": "extract-title",
      "to": "format-message",
      "action": "default"
    },
    {
      "from": "format-message",
      "to": "log-message",
      "action": "default"
    },
    {
      "from": "log-message",
      "to": "end",
      "action": "default"
    }
  ],
  "flow": {
    "startNodeId": "start"
  },
  "metadata": {
    "updatedAt": "2026-02-02T18:53:06.868Z"
  }
}