{
  "id": "parallel-api-calls",
  "name": "Parallel API Calls",
  "description": "Demo of cluster nodes executing multiple API calls in parallel",
  "version": "1.0.0",
  "nodes": [
    {
      "id": "start",
      "functionId": "core.start",
      "params": {},
      "position": {
        "x": -420,
        "y": -100
      },
      "label": "core.start"
    },
    {
      "id": "parallel-cluster",
      "functionId": "core.log",
      "params": {
        "message": "Starting parallel API calls"
      },
      "position": {
        "x": -40,
        "y": -180
      },
      "label": "core.log",
      "nodeType": "clusterRoot",
      "handles": [
        {
          "id": "handle-1771077795223-7eziq",
          "type": "source",
          "label": "New Handle",
          "position": "bottom"
        },
        {
          "id": "handle-1771077796114-dvozx",
          "type": "source",
          "label": "New Handle",
          "position": "bottom"
        },
        {
          "id": "handle-1771077796863-zvaju",
          "type": "source",
          "label": "New Handle",
          "position": "bottom"
        }
      ]
    },
    {
      "id": "fetch-users",
      "functionId": "http.request",
      "params": {
        "url": "https://jsonplaceholder.typicode.com/users/1",
        "method": "GET",
        "outputKey": "user"
      },
      "position": {
        "x": -240,
        "y": 240
      },
      "label": "http.request",
      "nodeType": "subNode",
      "handles": [
        {
          "id": "top",
          "type": "target",
          "position": "top"
        }
      ],
      "parentId": "parallel-cluster"
    },
    {
      "id": "fetch-posts",
      "functionId": "http.request",
      "params": {
        "url": "https://jsonplaceholder.typicode.com/posts/1",
        "method": "GET",
        "outputKey": "post"
      },
      "position": {
        "x": 100,
        "y": 240
      },
      "label": "http.request",
      "nodeType": "subNode",
      "handles": [
        {
          "id": "top",
          "type": "target",
          "position": "top"
        }
      ],
      "parentId": "parallel-cluster"
    },
    {
      "id": "fetch-comments",
      "functionId": "http.request",
      "params": {
        "url": "https://jsonplaceholder.typicode.com/comments/1",
        "method": "GET",
        "outputKey": "comment"
      },
      "position": {
        "x": 440,
        "y": 240
      },
      "label": "http.request",
      "nodeType": "subNode",
      "handles": [
        {
          "id": "top",
          "type": "target",
          "position": "top"
        }
      ],
      "parentId": "parallel-cluster"
    },
    {
      "id": "combine-results",
      "functionId": "core.log",
      "params": {
        "message": "All API calls completed - results in _subNodeOutputs"
      },
      "position": {
        "x": 550,
        "y": 50
      },
      "label": "core.log"
    },
    {
      "id": "end",
      "functionId": "core.end",
      "params": {},
      "position": {
        "x": 750,
        "y": 50
      },
      "label": "core.end"
    }
  ],
  "edges": [
    {
      "from": "start",
      "to": "parallel-cluster",
      "action": "default",
      "edgeType": "default"
    },
    {
      "from": "parallel-cluster",
      "to": "combine-results",
      "action": "default",
      "edgeType": "default"
    },
    {
      "from": "combine-results",
      "to": "end",
      "action": "default",
      "edgeType": "default"
    },
    {
      "from": "parallel-cluster",
      "to": "fetch-users",
      "action": "default",
      "sourceHandle": "handle-1771077795223-7eziq",
      "edgeType": "subnode"
    },
    {
      "from": "parallel-cluster",
      "to": "fetch-posts",
      "action": "default",
      "sourceHandle": "handle-1771077796114-dvozx",
      "edgeType": "subnode"
    },
    {
      "from": "parallel-cluster",
      "to": "fetch-comments",
      "action": "default",
      "sourceHandle": "handle-1771077796863-zvaju",
      "edgeType": "subnode"
    }
  ],
  "flow": {
    "startNodeId": "start"
  },
  "metadata": {
    "updatedAt": "2026-02-14T14:04:42.371Z"
  }
}